Service,Keywords,Google SERP questions
Infant weaning,baby led weaning,"What is the baby-led weaning rule?
What should I start with first for baby-led weaning?
Can you do purees and baby-led weaning?
Can I start weaning at 4 months?"
,blw infant feeding,"What is the BLW method of feeding?
When should I start feeding my BLW?
How much food should a baby eat during BLW?
Is BLW better than spoon-feeding?"
,baby weaning food,"Which is the best food to start weaning a baby?
Can you wean babies at 4 months?
When should baby have 3 meals a day?
What should a 6 month old eat?"
,infant weaning,"What are the 3 stages of weaning?
Is weaning at 4 months OK?
What is the normal age to wean a baby?
What is the 4 day rule for weaning?"
,weaning for infants,"What are the 3 stages of weaning?
Can you wean babies at 4 months?
When should a baby start weaning?
What is the 4 day rule for weaning?
"
Infant weight gain,infant weight gain,"How much weight should babies gain per week?
How much a baby should gain weight each month?
How much weight should a baby gain per week NHS?
How quickly do infants gain weight?
"
,newborn weight gain per week,"How much weight should a newborn gain per week?
How much weight should a breastfed newborn gain per week?
Do breastfed babies gain weight slower?
How much weight should a newborn gain in the first month?"
,average weight gain for newborn,"How much weight do newborns gain per week?
How much weight should newborn gain in first month?
How much weight should a breastfed baby gain?
What is the average weight for a 2 week old baby?"
``,newborn weight gain,"How much weight should newborn gain each week?
How much weight should a newborn gain in the first month?
How much weight should a baby gain per week NHS?
Do breastfed babies gain weight slower?
"
,newborn weight gain per day,"How much weight should a newborn gain each week?
How much should a breastfed newborn gain a day?
How much weight should a baby gain per week NHS?
How much weight do newborns gain each month?
"
,newborn not gaining weight,"When should I worry about my newborn not gaining weight?
Why isn't my newborn gaining weight?
How can I get my newborn to gain weight?
What happens if baby doesn't gain weight in a week?
"
Infant food allergies ,introducing allergens to baby,"What allergens should I introduce to my baby first?
How do I introduce allergens to my baby schedule?
How do I introduce allergens to my baby NHS?
Should you introduce allergenic foods to baby?"
,infant food allergies,"What is the most common food allergy in infants?
How do I know if my baby has food allergies?
How long does it take for a food allergy to show up in a baby?
How can I tell what my baby is allergic to?"
,cows milk allergy formula,"What formula is best for cows milk allergy?
How do I know if my baby is allergic to cow's milk formula?
Does formula cause cows milk allergy?
What to avoid with a cows milk allergy?"
,milk allergy formula,"What formula is best for milk allergy?
How do I know if my baby is allergic to dairy formula?
What is hypoallergenic formula NHS?
Is reflux the same as milk allergy in babies?"
,cow milk allergy formula,"What formula is best for cow milk allergy?
How do I know if my baby is allergic to cow's milk formula?
What milk is good for cow's milk allergy babies?
Does formula cause cows milk allergy?
"
,cows milk protein allergy formula,"What formula is best for cow's milk protein allergy?
Can babies with milk protein allergy have formula?
What baby milk has no cows milk protein?
What is the first line formula for CMPA?"
,newborn milk allergy,"
How do I know if my newborn has a milk allergy?
How long does a milk allergy take to show up in newborn?
What does milk intolerance look like in newborns?
What does baby poop look like with milk allergy?
"
,milk allergy formula,"What formula is best for milk allergy?
How do I know if my baby is allergic to dairy formula?
What is hypoallergenic formula NHS?
Is reflux the same as milk allergy in babies?"
,newborn milk allergy symptoms,"How long does a milk allergy take to show up in newborn?
What does baby poop look like with milk allergy?
What does milk intolerance look like in newborns?
What are signs of formula intolerance?"
,infant allergic reaction,"How do you treat an allergic reaction in babies?
How quickly does a baby have an allergic reaction?
"
,infant food allergies,"What is the most common food allergy in infants?
How do I know if my baby has food allergies?
How long does it take for a food allergy to show up in a baby?
How can I tell what my baby is allergic to?
"
,infant food allergy rash,"What do food allergy rashes look like in babies?
Is my baby's rash a food allergy?
How do I know if my baby's rash is an allergic reaction?
How long does it take for baby to have allergic reaction to new food?
"
Infant fussy eating,newborn fussy after eating,"Why is my newborn still fussy after eating?
How do I calm my fussy baby down after feeding?
Why is my baby not settling after feeding?
How do I settle my newborn after feeding?"
,newborn fussy after feeding,"Why is my newborn still fussy after eating?
Why is my baby so unsettled after feeding?
Why does my baby cry and squirm after feeding?
How do I calm my fussy baby down after feeding?
"
,newborn very fussy after eating,"Why is my newborn still fussy after eating?
How do I calm my fussy baby down after feeding?
Why is my baby not settling after feeding?
Why does my baby thrash around after feeding?"
,newborn is fussy after eating,"Why is my newborn still fussy after eating?
How do I calm my fussy baby down after feeding?
Why is my baby not settling after feeding?
How do I settle my newborn after feeding?
"
,infant fussy after feeding,"Why is my baby still fussy after feeding?
Why does my baby cry and squirm after feeding?
How do I calm my fussy baby down after feeding?
Why is my baby not settling after feeding?
"
,infant fussy while eating,"Why is my baby so fussy while eating?
Why does my baby grunt and squirm while eating?
Why is my baby so frantic when feeding?
Why does my baby cry and squirm when I feed her?
"
,newborn cranky after feeding,"Why is my newborn so fussy after every feeding?
Why is my baby so agitated after feeding?
Why is my newborn uncomfortable after eating?
How do you calm a fussy baby after feeding?
"
,newborn fussy after breastfeeding,"Why is my newborn fussy after breastfeeding?
Why is my baby crying and fussy after breastfeeding?
Why is my baby fussy right after feeding?
"
,newborn irritable after feeding,"Why is my baby so agitated after feeding?
Why is my newborn so fussy after every feeding?
Why is my newborn uncomfortable after eating?
Why does my baby squirm after feeding?"
,newborn restless after feeding,"Why is my baby restless after a feed?
Why is my newborn uncomfortable after eating?
"
Infant feeding difficulties,feeding difficulties in preterm infants,"What are 4 problems of infant feeding?
How does extreme prematurity impact on an infant's feeding skills?
What is the biggest problem usually has to do with premature babies?
"
,feeding disorders in infants,"What are common feeding disorders in infants?
What are some feeding disorders?
What causes feeding problems in infants?
What are the 4 domains of pediatric feeding disorder?"
,difficulty feeding newborn,Why is my newborn so hard to feed?
,feeding difficulties newborn,"What causes feeding difficulties in newborns?
Why is my baby so difficult to feed?
How do I know if my baby is having feeding difficulties?"
,newborn difficulty swallowing milk,"How do I know if my baby has dysphagia?
How do you treat dysphagia in newborns?
Why does my newborn make weird swallowing noises?"
,infant swallowing problems,"What are some signs of a swallowing disorder in infants?
Is it normal for babies to have trouble swallowing?
How do I know if my child has swallowing problems?
What are two signs of swallowing difficulties?
"
,swallowing problems in newborns,"Why would a newborn have trouble swallowing?
How do you treat dysphagia in newborns?
Why is my baby swallowing weird?
Do babies grow out of dysphagia?"
,infant feeding difficulties,"What causes feeding difficulties in infants?
What are some feeding difficulties?
What is feeding problems in infancy and early childhood?
What are feeding difficulties in pediatrics?
"
,feeding difficulties in newborn,"What causes feeding difficulties in newborns?
What are feeding difficulties due to baby?
How do I know if my baby has feeding problems?
What are the symptoms of feed intolerance in neonates?
"
,infant dysphagia treatment,"Does dysphagia go away in babies?
What causes infant dysphagia?
Is dysphagia common in babies?
What is the most common treatment for dysphagia?
"
,newborn difficulty breathing while feeding,"Why is my newborn breathing heavily while feeding?
Is it normal for newborn to stop breathing while eating?
Why is my baby not breathing through his nose when feeding?
"
Infant tube feeding,Infant tube feeding,"How long can a baby be on a feeding tube?
Is feeding tube painful for babies?
Do you burp a baby with a feeding tube?
How often should a baby feeding tube be changed?
"
,ng tube feeding in infants,"How do you feed a baby with an NG tube?
How long can a baby have an NG tube?
Why would a baby have an NG tube?
What are the side effects of NG tube in infants?"
,newborn with feeding tube,"How long can a newborn be on a feeding tube?
Why would a newborn have a feeding tube?
Can a newborn come home with a feeding tube?
Is feeding tube painful for babies?"
,ng tube feeding newborn,"Why would a newborn need an NG tube?
How long can a newborn be on a feeding tube?
How do you feed a baby with an NG tube?
Can a newborn come home with a feeding tube?
"
,newborn g tube,"How long do babies stay on G tube?
Why would a newborn need a Gtube?
What is a G tube for a baby?
Where is neonatal G tube placed?
"
,tube newborn,"What is the tube in newborns mouth for?
Why would a newborn have a tube in their nose?
How long can a newborn be on a feeding tube?
Is feeding tube painful for babies?
"
,ogt feeding in newborn,"How do you insert an OGT in a newborn?
Why is an orogastric tube feeding important?
How do you feed a newborn with a feeding tube?
Why would a newborn need a tube in their nose?
"
,orogastric tube feeding in newborn,"What is the purpose of the orogastric tube feeding?
How do you put an Orogastric tube in a newborn?
What are the risks of an Orogastric tube?
What is the difference between OG tube and NG tube in neonates?
"
,ng tube for newborn,"Why would a newborn need an NG tube?
How long can a baby have an NG tube?
What is a nasogastric tube for a newborn?
Where is the NG tube placed in a newborn?
"
,g tube newborn,"How long do babies stay on G tube?
Why do newborns need G tubes?
What is G tube surgery on a baby?
Can a NICU baby come home with a feeding tube?
"
,orogastric tube newborn,"What is an Orogastric tube for a newborn?
Where do you place the OG tube on a newborn?
What are the reasons for Orogastric tube?
What is the difference between OG tube and NG tube in neonates?
"
,newborn feeding tube,"Why would a newborn need a feeding tube?
How long can a newborn be on a feeding tube?
Is feeding tube painful for babies?
Can a newborn come home with a feeding tube?
"
Infant constipation,newborn constipation remedies breastfed,"What helps a breastfed baby with constipation?
Why is my breastfed newborn so constipated?
How do I Unconstipate my newborn?
Can my breast milk make baby constipated?"
,infant constipation,"How do I relieve constipation in an infant?
How long is it OK for a baby to be constipated?
Can you give a baby cooled boiled water for constipation?
Can you give a newborn water for constipation?"
,newborn constipation breastfed,"What helps a breastfed baby with constipation?
Is it normal for breastfed newborns to be constipated?
Is it normal for breastfed babies to not poo in 3 days?
Can you give a baby cooled boiled water for constipation?
"
,neonatal constipation,"How do you treat constipation in neonates?
What are the common causes of constipation in neonates?
Is constipation common in newborns?
How serious is newborn constipation?
"
,my newborn is constipated,"How long can a newborn go without pooping?
How serious is newborn constipation?
Can I give constipation ease to my newborn?
What if my newborn hasn't pooped in 2 days?"
,newborn laxative,"What can I give my newborn to help poop?
How can I help my 2 week old with constipation?
Does Infacol help babies poop?
Can I give my 1 month old apple juice for constipation?
"
,constipation in infants 1 months old,"How can I help my 1 month old with constipation?
Should I be worried if my 1 month old is constipated?
How long is too long for a 1 month old to not poop?
What if my 1 month old baby won't poop?
"
,newborn constipation remedies,"Can I give my 2 week old apple juice for constipation?
Does Infacol help babies poop?
Can babies have cooled boiled water for constipation?
How long can a newborn go without pooping?"
,constipation in infants 2 months old,"What do I do if my 2 month old is constipated?
Should I be worried if my 2 month old hasn t pooped in 2 days?
Why does my 2 month old have trouble pooping?
"
,newborn hard to poop,"Why does my newborn push so hard to poop?
What to do if your newborn is struggling to poop?"
,newborn constipation,"How do you fix constipation in newborns?
How long can a newborn go without pooping?
How serious is newborn constipation?
Why hasn't my newborn pooped in 12 hours?"
,infant laxative drops,"Is there a laxative safe for babies?
Which laxative is best for infants?
Can I give my baby constipation drops?
What is a gentle laxative for infants?
"
,newborn constipation formula fed,"What do you do if your newborn is constipated from formula?
How can I help my constipated formula-fed baby?
Should I switch formula if my newborn is constipated?
Can I give newborn water for constipation?
"
,constipation in infants 1 months old,"How can I help my 1 month old with constipation?
Should I be worried if my 1 month old is constipated?
How long is too long for a 1 month old to not poop?
What if my 1 month old baby won't poop?"
,help newborn poop,"How can I stimulate my newborn to poop?
Why is my newborn struggling to poop?
How long can a newborn go without pooping?
Can you give a baby cooled boiled water for constipation?
"
Infant refulx,"acid refulx in infants
","How do I know if my baby has acid reflux?
How can I ease my baby's acid reflux?
What triggers acid reflux in babies?
Does Infacol treat acid reflux?
"
,infant reflux,"How do I know if my baby has reflux?
How can I help my newborn with reflux?
Can you give Infacol to a baby with reflux?
Will reflux go away on its own newborn?
"
Infant ARFID,Infant ARFID,"
Can an infant have ARFID?
What is the youngest age for ARFID?
What age is ARFID most common?
What age group does ARFID affect?
"